Timestamp,Article_ID,Current H1,Proposed H1,H1 Length,Current Title,Proposed Title,Description,Title Length,Same H1 Re-Generation,H1 Max Length,H1 Unique,Title Max Length,Title Unique,Description Length Check,Description Length
2024-10-23 02:02:23,283247,Understanding 5 Misconceptions About Linux Security Among Users,Understanding Key Misconceptions About Linux Security for Users,63,Understanding 5 Misconceptions About Linux Security Among Users,Debunking 5 Common Misconceptions About Linux Security,Explore common misconceptions about Linux security and enhance your understanding.,54,pass,pass,pass,pass,pass,pass,82
2024-10-24 00:04:23,283247,Understanding 5 Misconceptions About Linux Security Among Users,Understanding Common Misconceptions About Linux Security for Users,66,Understanding 5 Misconceptions About Linux Security Among Users,Debunking 5 Common Misconceptions About Linux Security,Explore common misconceptions about Linux security and enhance your understanding.,54,pass,pass,pass,pass,pass,pass,82
2024-10-24 00:06:28,283247,Understanding 5 Misconceptions About Linux Security Among Users,Understanding Key Misconceptions About Linux Security for Users,63,Understanding 5 Misconceptions About Linux Security Among Users,Debunking 5 Common Misconceptions About Linux Security,Explore common misconceptions about Linux security and enhance your understanding.,54,pass,pass,pass,pass,pass,pass,82
2024-10-24 00:11:12,283247,Understanding 5 Misconceptions About Linux Security Among Users,Understanding Common Misconceptions About Linux Security Among Users,68,Understanding 5 Misconceptions About Linux Security Among Users,Debunking 5 Common Misconceptions About Linux Security,Explore common misconceptions about Linux security and how to address them effectively.,54,pass,pass,pass,pass,pass,pass,87
2024-10-24 00:11:59,283265,U.S. Officials Say Huawei Can Covertly Access Telecom Networks,U.S. Officials Warn of Huawei's Covert Access to Mobile Networks,64,U.S. Officials Say Huawei Can Covertly Access Telecom Networks,Huawei's Covert Access to Telecom Networks Raises Security Concerns,"U.S. officials warn of Huawei's covert access to telecom networks, raising security concerns.",67,pass,pass,pass,pass,pass,pass,93
2024-10-24 00:14:06,283265,U.S. Officials Warn of Huawei's Covert Access to Mobile Networks,U.S. Officials Raise Alarm on Huawei's Covert Network Access Risks,66,U.S. Officials Warn of Huawei's Covert Access to Mobile Networks,Huawei's Covert Access to Mobile Networks: Security Advisory,"U.S. officials alert on Huawei's potential covert access to mobile networks, raising security concerns.",60,pass,pass,pass,pass,pass,pass,103
2024-10-24 00:14:30,283266,"Firefox 73 Released With Security Fixes, New DoH Provider, More",Explore Firefox 73's Security Fixes and New DoH Provider Features,65,"Firefox 73 Released With Security Fixes, New DoH Provider, More",Firefox 73 Security Update: Fixes and DoH Provider Changes,Mozilla's Firefox 73 introduces critical security fixes and a new DoH provider.,58,pass,pass,pass,pass,pass,pass,79
2024-10-24 00:15:06,283282,A new senate bill would create a US data protection agency,Impacts of Proposed US Data Protection Agency on Privacy Regulations,68,A new senate bill would create a US data protection agency,New US Bill Proposes Data Protection Agency for Enhanced Privacy,Explore the implications of a new US data protection agency bill on privacy laws.,64,pass,pass,pass,pass,pass,pass,81
